<?xml version="1.0" encoding="UTF-8"?>
<tns:root xmlns:tns="http://www.example.org/zbx_template_new/" xmlns:xsi="http://www.w3.org/2001/XMLSchema-instance" xsi:schemaLocation="http://www.example.org/zbx_template_new/ ../../main/resources/templates/zbx_template_new.xsd ">
  <template>
	  <name>Cisco</name>
	  <metrics>
	    <cpuLoad>
	      <name>CPU Load</name>
	      <group>cpu</group>
	      <oid>{oid}</oid>
	    </cpuLoad>
	    <cpuUtil>
	      <name>CPU Utilization</name>
	      <group>cpu</group>
	      <oid>{oid}</oid>
	    </cpuUtil>
	    <memoryUsed>
	      <name>Memory Used</name>
	      <group>memory</group>
	      <oid>{oid}</oid>
	      <description>Memory Used in megabytes</description>
	    </memoryUsed>
	    <memoryFree>
	      <name>Memory free</name>
	      <group>memory</group>
	      <oid>{oid}</oid>
	    </memoryFree>
	  </metrics>
  </template>
</tns:root>
